    1   0.000000 192.168.11.5 → 122.222.40.105 TCP 55 64024 → 80 [ACK] Seq=1 Ack=1 Win=16186 Len=1
    2   0.017780 122.222.40.105 → 192.168.11.5 TCP 66 80 → 64024 [ACK] Seq=1 Ack=2 Win=245 Len=0 SLE=1 SRE=2
    3   0.247869 192.168.11.5 → 54.240.227.97 TCP 55 63339 → 80 [ACK] Seq=1 Ack=1 Win=16060 Len=1
    4   0.331796 54.240.227.97 → 192.168.11.5 TCP 60 80 → 63339 [ACK] Seq=1 Ack=2 Win=127 Len=0
    5   0.342904 192.168.11.5 → 163.139.173.221 TCP 55 63330 → 80 [ACK] Seq=1 Ack=1 Win=16258 Len=1
    6   0.359640 163.139.173.221 → 192.168.11.5 TCP 66 80 → 63330 [ACK] Seq=1 Ack=2 Win=255 Len=0 SLE=1 SRE=2
