    1   0.000000    127.0.0.1 → 127.0.0.1    TCP 56 52962 → 10000 [PSH, ACK] Seq=1 Ack=1 Win=10200 Len=12
    2   0.000135    127.0.0.1 → 127.0.0.1    TCP 44 10000 → 52962 [ACK] Seq=1 Ack=13 Win=10039 Len=0
    3   0.000210    127.0.0.1 → 127.0.0.1    TCP 56 52962 → 10000 [PSH, ACK] Seq=13 Ack=1 Win=10200 Len=12
    4   0.000245    127.0.0.1 → 127.0.0.1    TCP 44 10000 → 52962 [ACK] Seq=1 Ack=25 Win=10039 Len=0
    5   0.000294    127.0.0.1 → 127.0.0.1    TCP 56 52962 → 10000 [PSH, ACK] Seq=25 Ack=1 Win=10200 Len=12
    6   0.000333    127.0.0.1 → 127.0.0.1    TCP 44 10000 → 52962 [ACK] Seq=1 Ack=37 Win=10039 Len=0
    7   0.000399    127.0.0.1 → 127.0.0.1    TCP 56 52962 → 10000 [PSH, ACK] Seq=37 Ack=1 Win=10200 Len=12
    8   0.000441    127.0.0.1 → 127.0.0.1    TCP 44 10000 → 52962 [ACK] Seq=1 Ack=49 Win=10039 Len=0
    9   0.000490    127.0.0.1 → 127.0.0.1    TCP 56 52962 → 10000 [PSH, ACK] Seq=49 Ack=1 Win=10200 Len=12
   10   0.000523    127.0.0.1 → 127.0.0.1    TCP 44 10000 → 52962 [ACK] Seq=1 Ack=61 Win=10039 Len=0
   11   0.000568    127.0.0.1 → 127.0.0.1    TCP 56 52962 → 10000 [PSH, ACK] Seq=61 Ack=1 Win=10200 Len=12
   12   0.000600    127.0.0.1 → 127.0.0.1    TCP 57 10000 → 52962 [PSH, ACK] Seq=1 Ack=61 Win=10039 Len=13
   13   0.000669    127.0.0.1 → 127.0.0.1    TCP 80 52962 → 10000 [PSH, ACK] Seq=73 Ack=14 Win=10200 Len=36
   14   0.000723    127.0.0.1 → 127.0.0.1    TCP 44 10000 → 52962 [ACK] Seq=14 Ack=109 Win=10039 Len=0
   15   0.000776    127.0.0.1 → 127.0.0.1    TCP 128 52962 → 10000 [PSH, ACK] Seq=109 Ack=14 Win=10200 Len=84
   16   0.000870    127.0.0.1 → 127.0.0.1    TCP 44 10000 → 52962 [ACK] Seq=14 Ack=193 Win=10038 Len=0
   17   0.000879    127.0.0.1 → 127.0.0.1    TCP 57 10000 → 52962 [PSH, ACK] Seq=14 Ack=193 Win=10038 Len=13
   18   0.000963    127.0.0.1 → 127.0.0.1    TCP 188 52962 → 10000 [PSH, ACK] Seq=193 Ack=27 Win=10199 Len=144
   19   0.001009    127.0.0.1 → 127.0.0.1    TCP 44 10000 → 52962 [ACK] Seq=27 Ack=337 Win=10038 Len=0
   20   0.001053    127.0.0.1 → 127.0.0.1    TCP 92 52962 → 10000 [PSH, ACK] Seq=337 Ack=27 Win=10199 Len=48
   21   0.001082    127.0.0.1 → 127.0.0.1    TCP 44 10000 → 52962 [ACK] Seq=27 Ack=385 Win=10037 Len=0
   22   0.001102    127.0.0.1 → 127.0.0.1    TCP 92 52962 → 10000 [PSH, ACK] Seq=385 Ack=27 Win=10199 Len=48
   23   0.001121    127.0.0.1 → 127.0.0.1    TCP 44 10000 → 52962 [ACK] Seq=27 Ack=433 Win=10037 Len=0
   24   0.001871    127.0.0.1 → 127.0.0.1    TCP 57 10000 → 52962 [PSH, ACK] Seq=27 Ack=433 Win=10037 Len=13
   25   0.001911    127.0.0.1 → 127.0.0.1    TCP 44 52962 → 10000 [ACK] Seq=433 Ack=40 Win=10199 Len=0
   26   0.001954    127.0.0.1 → 127.0.0.1    TCP 57 10000 → 52962 [PSH, ACK] Seq=40 Ack=433 Win=10037 Len=13
   27   0.001984    127.0.0.1 → 127.0.0.1    TCP 44 52962 → 10000 [ACK] Seq=433 Ack=53 Win=10199 Len=0
   28   0.002023    127.0.0.1 → 127.0.0.1    TCP 57 10000 → 52962 [PSH, ACK] Seq=53 Ack=433 Win=10037 Len=13
   29   0.002070    127.0.0.1 → 127.0.0.1    TCP 44 52962 → 10000 [ACK] Seq=433 Ack=66 Win=10199 Len=0
   30   0.002127    127.0.0.1 → 127.0.0.1    TCP 57 10000 → 52962 [PSH, ACK] Seq=66 Ack=433 Win=10037 Len=13
   31   0.002168    127.0.0.1 → 127.0.0.1    TCP 44 52962 → 10000 [ACK] Seq=433 Ack=79 Win=10199 Len=0
   32   0.002226    127.0.0.1 → 127.0.0.1    TCP 57 10000 → 52962 [PSH, ACK] Seq=79 Ack=433 Win=10037 Len=13
   33   0.002269    127.0.0.1 → 127.0.0.1    TCP 44 52962 → 10000 [ACK] Seq=433 Ack=92 Win=10199 Len=0
   34   0.002325    127.0.0.1 → 127.0.0.1    TCP 57 10000 → 52962 [PSH, ACK] Seq=92 Ack=433 Win=10037 Len=13
   35   0.002370    127.0.0.1 → 127.0.0.1    TCP 44 52962 → 10000 [ACK] Seq=433 Ack=105 Win=10199 Len=0
   36   0.002425    127.0.0.1 → 127.0.0.1    TCP 57 10000 → 52962 [PSH, ACK] Seq=105 Ack=433 Win=10037 Len=13
   37   0.002468    127.0.0.1 → 127.0.0.1    TCP 44 52962 → 10000 [ACK] Seq=433 Ack=118 Win=10199 Len=0
   38   0.002527    127.0.0.1 → 127.0.0.1    TCP 57 10000 → 52962 [PSH, ACK] Seq=118 Ack=433 Win=10037 Len=13
   39   0.002567    127.0.0.1 → 127.0.0.1    TCP 44 52962 → 10000 [ACK] Seq=433 Ack=131 Win=10199 Len=0
   40   0.002624    127.0.0.1 → 127.0.0.1    TCP 57 10000 → 52962 [PSH, ACK] Seq=131 Ack=433 Win=10037 Len=13
   41   0.002667    127.0.0.1 → 127.0.0.1    TCP 44 52962 → 10000 [ACK] Seq=433 Ack=144 Win=10199 Len=0
   42   0.002722    127.0.0.1 → 127.0.0.1    TCP 57 10000 → 52962 [PSH, ACK] Seq=144 Ack=433 Win=10037 Len=13
   43   0.002774    127.0.0.1 → 127.0.0.1    TCP 44 52962 → 10000 [ACK] Seq=433 Ack=157 Win=10199 Len=0
   44   0.002829    127.0.0.1 → 127.0.0.1    TCP 57 10000 → 52962 [PSH, ACK] Seq=157 Ack=433 Win=10037 Len=13
   45   0.002872    127.0.0.1 → 127.0.0.1    TCP 44 52962 → 10000 [ACK] Seq=433 Ack=170 Win=10199 Len=0
   46   0.002930    127.0.0.1 → 127.0.0.1    TCP 57 10000 → 52962 [PSH, ACK] Seq=170 Ack=433 Win=10037 Len=13
   47   0.002969    127.0.0.1 → 127.0.0.1    TCP 44 52962 → 10000 [ACK] Seq=433 Ack=183 Win=10199 Len=0
   48   0.003028    127.0.0.1 → 127.0.0.1    TCP 64 10000 → 52962 [PSH, ACK] Seq=183 Ack=433 Win=10037 Len=20
   49   0.003070    127.0.0.1 → 127.0.0.1    TCP 44 52962 → 10000 [ACK] Seq=433 Ack=203 Win=10199 Len=0
   50   0.003126    127.0.0.1 → 127.0.0.1    TCP 64 10000 → 52962 [PSH, ACK] Seq=203 Ack=433 Win=10037 Len=20
   51   0.003170    127.0.0.1 → 127.0.0.1    TCP 44 52962 → 10000 [ACK] Seq=433 Ack=223 Win=10199 Len=0
   52   0.003224    127.0.0.1 → 127.0.0.1    TCP 57 10000 → 52962 [PSH, ACK] Seq=223 Ack=433 Win=10037 Len=13
   53   0.003267    127.0.0.1 → 127.0.0.1    TCP 44 52962 → 10000 [ACK] Seq=433 Ack=236 Win=10199 Len=0
   54   0.003323    127.0.0.1 → 127.0.0.1    TCP 57 10000 → 52962 [PSH, ACK] Seq=236 Ack=433 Win=10037 Len=13
   55   0.003363    127.0.0.1 → 127.0.0.1    TCP 44 52962 → 10000 [ACK] Seq=433 Ack=249 Win=10199 Len=0
   56   0.003420    127.0.0.1 → 127.0.0.1    TCP 57 10000 → 52962 [PSH, ACK] Seq=249 Ack=433 Win=10037 Len=13
   57   0.003462    127.0.0.1 → 127.0.0.1    TCP 44 52962 → 10000 [ACK] Seq=433 Ack=262 Win=10199 Len=0
   58   0.003521    127.0.0.1 → 127.0.0.1    TCP 64 10000 → 52962 [PSH, ACK] Seq=262 Ack=433 Win=10037 Len=20
   59   0.003564    127.0.0.1 → 127.0.0.1    TCP 44 52962 → 10000 [ACK] Seq=433 Ack=282 Win=10198 Len=0
   60   0.003622    127.0.0.1 → 127.0.0.1    TCP 64 10000 → 52962 [PSH, ACK] Seq=282 Ack=433 Win=10037 Len=20
   61   0.003665    127.0.0.1 → 127.0.0.1    TCP 44 52962 → 10000 [ACK] Seq=433 Ack=302 Win=10198 Len=0
   62   0.003721    127.0.0.1 → 127.0.0.1    TCP 57 10000 → 52962 [PSH, ACK] Seq=302 Ack=433 Win=10037 Len=13
   63   0.003772    127.0.0.1 → 127.0.0.1    TCP 44 52962 → 10000 [ACK] Seq=433 Ack=315 Win=10198 Len=0
   64   0.003828    127.0.0.1 → 127.0.0.1    TCP 57 10000 → 52962 [PSH, ACK] Seq=315 Ack=433 Win=10037 Len=13
   65   0.003872    127.0.0.1 → 127.0.0.1    TCP 44 52962 → 10000 [ACK] Seq=433 Ack=328 Win=10198 Len=0
   66   0.003931    127.0.0.1 → 127.0.0.1    TCP 57 10000 → 52962 [PSH, ACK] Seq=328 Ack=433 Win=10037 Len=13
   67   0.003972    127.0.0.1 → 127.0.0.1    TCP 44 52962 → 10000 [ACK] Seq=433 Ack=341 Win=10198 Len=0
   68   0.004032    127.0.0.1 → 127.0.0.1    TCP 64 10000 → 52962 [PSH, ACK] Seq=341 Ack=433 Win=10037 Len=20
   69   0.004075    127.0.0.1 → 127.0.0.1    TCP 44 52962 → 10000 [ACK] Seq=433 Ack=361 Win=10198 Len=0
   70   0.004134    127.0.0.1 → 127.0.0.1    TCP 64 10000 → 52962 [PSH, ACK] Seq=361 Ack=433 Win=10037 Len=20
   71   0.004177    127.0.0.1 → 127.0.0.1    TCP 44 52962 → 10000 [ACK] Seq=433 Ack=381 Win=10198 Len=0
   72   0.004238    127.0.0.1 → 127.0.0.1    TCP 57 10000 → 52962 [PSH, ACK] Seq=381 Ack=433 Win=10037 Len=13
   73   0.004281    127.0.0.1 → 127.0.0.1    TCP 44 52962 → 10000 [ACK] Seq=433 Ack=394 Win=10198 Len=0
   74   0.004856    127.0.0.1 → 127.0.0.1    TCP 64 10000 → 52962 [PSH, ACK] Seq=394 Ack=433 Win=10037 Len=20
   75   0.004900    127.0.0.1 → 127.0.0.1    TCP 44 52962 → 10000 [ACK] Seq=433 Ack=414 Win=10198 Len=0
   76   0.004945    127.0.0.1 → 127.0.0.1    TCP 57 10000 → 52962 [PSH, ACK] Seq=414 Ack=433 Win=10037 Len=13
   77   0.004976    127.0.0.1 → 127.0.0.1    TCP 44 52962 → 10000 [ACK] Seq=433 Ack=427 Win=10198 Len=0
   78   0.005017    127.0.0.1 → 127.0.0.1    TCP 57 10000 → 52962 [PSH, ACK] Seq=427 Ack=433 Win=10037 Len=13
   79   0.005048    127.0.0.1 → 127.0.0.1    TCP 44 52962 → 10000 [ACK] Seq=433 Ack=440 Win=10198 Len=0
   80   0.005087    127.0.0.1 → 127.0.0.1    TCP 57 10000 → 52962 [PSH, ACK] Seq=440 Ack=433 Win=10037 Len=13
   81   0.005121    127.0.0.1 → 127.0.0.1    TCP 44 52962 → 10000 [ACK] Seq=433 Ack=453 Win=10198 Len=0
   82   0.005161    127.0.0.1 → 127.0.0.1    TCP 57 10000 → 52962 [PSH, ACK] Seq=453 Ack=433 Win=10037 Len=13
   83   0.005195    127.0.0.1 → 127.0.0.1    TCP 44 52962 → 10000 [ACK] Seq=433 Ack=466 Win=10198 Len=0
   84   0.005234    127.0.0.1 → 127.0.0.1    TCP 57 10000 → 52962 [PSH, ACK] Seq=466 Ack=433 Win=10037 Len=13
   85   0.005271    127.0.0.1 → 127.0.0.1    TCP 44 52962 → 10000 [ACK] Seq=433 Ack=479 Win=10198 Len=0
   86   0.264932    127.0.0.1 → 127.0.0.1    TCP 56 52962 → 10000 [PSH, ACK] Seq=433 Ack=479 Win=10198 Len=12
   87   0.265053    127.0.0.1 → 127.0.0.1    TCP 44 10000 → 52962 [ACK] Seq=479 Ack=445 Win=10037 Len=0
   88   0.265131    127.0.0.1 → 127.0.0.1    TCP 56 52962 → 10000 [PSH, ACK] Seq=445 Ack=479 Win=10198 Len=12
   89   0.265181    127.0.0.1 → 127.0.0.1    TCP 44 10000 → 52962 [ACK] Seq=479 Ack=457 Win=10037 Len=0
   90   0.265239    127.0.0.1 → 127.0.0.1    TCP 56 52962 → 10000 [PSH, ACK] Seq=457 Ack=479 Win=10198 Len=12
   91   0.265272    127.0.0.1 → 127.0.0.1    TCP 44 10000 → 52962 [ACK] Seq=479 Ack=469 Win=10037 Len=0
   92   0.265335    127.0.0.1 → 127.0.0.1    TCP 56 52962 → 10000 [PSH, ACK] Seq=469 Ack=479 Win=10198 Len=12
   93   0.265370    127.0.0.1 → 127.0.0.1    TCP 44 10000 → 52962 [ACK] Seq=479 Ack=481 Win=10037 Len=0
   94   0.265417    127.0.0.1 → 127.0.0.1    TCP 56 52962 → 10000 [PSH, ACK] Seq=481 Ack=479 Win=10198 Len=12
   95   0.265449    127.0.0.1 → 127.0.0.1    TCP 44 10000 → 52962 [ACK] Seq=479 Ack=493 Win=10037 Len=0
   96   0.265493    127.0.0.1 → 127.0.0.1    TCP 56 52962 → 10000 [PSH, ACK] Seq=493 Ack=479 Win=10198 Len=12
   97   0.265525    127.0.0.1 → 127.0.0.1    TCP 44 10000 → 52962 [ACK] Seq=479 Ack=505 Win=10037 Len=0
   98   0.265556    127.0.0.1 → 127.0.0.1    TCP 57 10000 → 52962 [PSH, ACK] Seq=479 Ack=505 Win=10037 Len=13
   99   0.265620    127.0.0.1 → 127.0.0.1    TCP 56 52962 → 10000 [PSH, ACK] Seq=505 Ack=479 Win=10198 Len=12
  100   0.265632    127.0.0.1 → 127.0.0.1    TCP 44 52962 → 10000 [ACK] Seq=517 Ack=492 Win=10198 Len=0
  101   0.265686    127.0.0.1 → 127.0.0.1    TCP 44 10000 → 52962 [ACK] Seq=492 Ack=517 Win=10037 Len=0
  102   0.265724    127.0.0.1 → 127.0.0.1    TCP 104 52962 → 10000 [PSH, ACK] Seq=517 Ack=492 Win=10198 Len=60
  103   0.265797    127.0.0.1 → 127.0.0.1    TCP 44 10000 → 52962 [ACK] Seq=492 Ack=577 Win=10037 Len=0
  104   0.265843    127.0.0.1 → 127.0.0.1    TCP 57 10000 → 52962 [PSH, ACK] Seq=492 Ack=577 Win=10037 Len=13
  105   0.265851    127.0.0.1 → 127.0.0.1    TCP 68 52962 → 10000 [PSH, ACK] Seq=577 Ack=492 Win=10198 Len=24
  106   0.265925    127.0.0.1 → 127.0.0.1    TCP 92 52962 → 10000 [PSH, ACK] Seq=601 Ack=505 Win=10198 Len=48
  107   0.265933    127.0.0.1 → 127.0.0.1    TCP 57 10000 → 52962 [PSH, ACK] Seq=505 Ack=601 Win=10037 Len=13
  108   0.266007    127.0.0.1 → 127.0.0.1    TCP 44 10000 → 52962 [ACK] Seq=518 Ack=649 Win=10036 Len=0
  109   0.266015    127.0.0.1 → 127.0.0.1    TCP 92 52962 → 10000 [PSH, ACK] Seq=649 Ack=518 Win=10198 Len=48
  110   0.266070    127.0.0.1 → 127.0.0.1    TCP 92 52962 → 10000 [PSH, ACK] Seq=697 Ack=518 Win=10198 Len=48
  111   0.266077    127.0.0.1 → 127.0.0.1    TCP 44 10000 → 52962 [ACK] Seq=518 Ack=697 Win=10036 Len=0
  112   0.266135    127.0.0.1 → 127.0.0.1    TCP 44 10000 → 52962 [ACK] Seq=518 Ack=745 Win=10036 Len=0
  113   0.266142    127.0.0.1 → 127.0.0.1    TCP 104 52962 → 10000 [PSH, ACK] Seq=745 Ack=518 Win=10198 Len=60
  114   0.266199    127.0.0.1 → 127.0.0.1    TCP 80 52962 → 10000 [PSH, ACK] Seq=805 Ack=518 Win=10198 Len=36
  115   0.266205    127.0.0.1 → 127.0.0.1    TCP 44 10000 → 52962 [ACK] Seq=518 Ack=805 Win=10036 Len=0
  116   0.266253    127.0.0.1 → 127.0.0.1    TCP 44 10000 → 52962 [ACK] Seq=518 Ack=841 Win=10036 Len=0
  117   0.266259    127.0.0.1 → 127.0.0.1    TCP 68 52962 → 10000 [PSH, ACK] Seq=841 Ack=518 Win=10198 Len=24
  118   0.266295    127.0.0.1 → 127.0.0.1    TCP 44 10000 → 52962 [ACK] Seq=518 Ack=865 Win=10036 Len=0
  119   0.266535    127.0.0.1 → 127.0.0.1    TCP 57 10000 → 52962 [PSH, ACK] Seq=518 Ack=865 Win=10036 Len=13
  120   0.266603    127.0.0.1 → 127.0.0.1    TCP 44 52962 → 10000 [ACK] Seq=865 Ack=531 Win=10198 Len=0
  121   0.266674    127.0.0.1 → 127.0.0.1    TCP 57 10000 → 52962 [PSH, ACK] Seq=531 Ack=865 Win=10036 Len=13
  122   0.266748    127.0.0.1 → 127.0.0.1    TCP 44 52962 → 10000 [ACK] Seq=865 Ack=544 Win=10197 Len=0
  123   0.266808    127.0.0.1 → 127.0.0.1    TCP 57 10000 → 52962 [PSH, ACK] Seq=544 Ack=865 Win=10036 Len=13
  124   0.266869    127.0.0.1 → 127.0.0.1    TCP 44 52962 → 10000 [ACK] Seq=865 Ack=557 Win=10197 Len=0
  125   0.266937    127.0.0.1 → 127.0.0.1    TCP 57 10000 → 52962 [PSH, ACK] Seq=557 Ack=865 Win=10036 Len=13
  126   0.266991    127.0.0.1 → 127.0.0.1    TCP 44 52962 → 10000 [ACK] Seq=865 Ack=570 Win=10197 Len=0
  127   0.267058    127.0.0.1 → 127.0.0.1    TCP 57 10000 → 52962 [PSH, ACK] Seq=570 Ack=865 Win=10036 Len=13
  128   0.267118    127.0.0.1 → 127.0.0.1    TCP 44 52962 → 10000 [ACK] Seq=865 Ack=583 Win=10197 Len=0
  129   0.267185    127.0.0.1 → 127.0.0.1    TCP 57 10000 → 52962 [PSH, ACK] Seq=583 Ack=865 Win=10036 Len=13
  130   0.267246    127.0.0.1 → 127.0.0.1    TCP 44 52962 → 10000 [ACK] Seq=865 Ack=596 Win=10197 Len=0
  131   0.267315    127.0.0.1 → 127.0.0.1    TCP 57 10000 → 52962 [PSH, ACK] Seq=596 Ack=865 Win=10036 Len=13
  132   0.267376    127.0.0.1 → 127.0.0.1    TCP 44 52962 → 10000 [ACK] Seq=865 Ack=609 Win=10197 Len=0
  133   0.267444    127.0.0.1 → 127.0.0.1    TCP 57 10000 → 52962 [PSH, ACK] Seq=609 Ack=865 Win=10036 Len=13
  134   0.267505    127.0.0.1 → 127.0.0.1    TCP 44 52962 → 10000 [ACK] Seq=865 Ack=622 Win=10197 Len=0
  135   0.267572    127.0.0.1 → 127.0.0.1    TCP 57 10000 → 52962 [PSH, ACK] Seq=622 Ack=865 Win=10036 Len=13
  136   0.267634    127.0.0.1 → 127.0.0.1    TCP 44 52962 → 10000 [ACK] Seq=865 Ack=635 Win=10197 Len=0
  137   0.267702    127.0.0.1 → 127.0.0.1    TCP 57 10000 → 52962 [PSH, ACK] Seq=635 Ack=865 Win=10036 Len=13
  138   0.267753    127.0.0.1 → 127.0.0.1    TCP 44 52962 → 10000 [ACK] Seq=865 Ack=648 Win=10197 Len=0
  139   0.267822    127.0.0.1 → 127.0.0.1    TCP 57 10000 → 52962 [PSH, ACK] Seq=648 Ack=865 Win=10036 Len=13
  140   0.267884    127.0.0.1 → 127.0.0.1    TCP 44 52962 → 10000 [ACK] Seq=865 Ack=661 Win=10197 Len=0
  141   0.267952    127.0.0.1 → 127.0.0.1    TCP 64 10000 → 52962 [PSH, ACK] Seq=661 Ack=865 Win=10036 Len=20
  142   0.268014    127.0.0.1 → 127.0.0.1    TCP 44 52962 → 10000 [ACK] Seq=865 Ack=681 Win=10197 Len=0
  143   0.268082    127.0.0.1 → 127.0.0.1    TCP 64 10000 → 52962 [PSH, ACK] Seq=681 Ack=865 Win=10036 Len=20
  144   0.268144    127.0.0.1 → 127.0.0.1    TCP 44 52962 → 10000 [ACK] Seq=865 Ack=701 Win=10197 Len=0
  145   0.268193    127.0.0.1 → 127.0.0.1    TCP 57 10000 → 52962 [PSH, ACK] Seq=701 Ack=865 Win=10036 Len=13
  146   0.268255    127.0.0.1 → 127.0.0.1    TCP 44 52962 → 10000 [ACK] Seq=865 Ack=714 Win=10197 Len=0
  147   0.268888    127.0.0.1 → 127.0.0.1    TCP 57 10000 → 52962 [PSH, ACK] Seq=714 Ack=865 Win=10036 Len=13
  148   0.268934    127.0.0.1 → 127.0.0.1    TCP 44 52962 → 10000 [ACK] Seq=865 Ack=727 Win=10197 Len=0
  149   0.268979    127.0.0.1 → 127.0.0.1    TCP 57 10000 → 52962 [PSH, ACK] Seq=727 Ack=865 Win=10036 Len=13
  150   0.269014    127.0.0.1 → 127.0.0.1    TCP 44 52962 → 10000 [ACK] Seq=865 Ack=740 Win=10197 Len=0
  151   0.269055    127.0.0.1 → 127.0.0.1    TCP 64 10000 → 52962 [PSH, ACK] Seq=740 Ack=865 Win=10036 Len=20
  152   0.269088    127.0.0.1 → 127.0.0.1    TCP 44 52962 → 10000 [ACK] Seq=865 Ack=760 Win=10197 Len=0
  153   0.269128    127.0.0.1 → 127.0.0.1    TCP 64 10000 → 52962 [PSH, ACK] Seq=760 Ack=865 Win=10036 Len=20
  154   0.269164    127.0.0.1 → 127.0.0.1    TCP 44 52962 → 10000 [ACK] Seq=865 Ack=780 Win=10197 Len=0
  155   0.269205    127.0.0.1 → 127.0.0.1    TCP 57 10000 → 52962 [PSH, ACK] Seq=780 Ack=865 Win=10036 Len=13
  156   0.269241    127.0.0.1 → 127.0.0.1    TCP 44 52962 → 10000 [ACK] Seq=865 Ack=793 Win=10196 Len=0
  157   0.269281    127.0.0.1 → 127.0.0.1    TCP 57 10000 → 52962 [PSH, ACK] Seq=793 Ack=865 Win=10036 Len=13
  158   0.269313    127.0.0.1 → 127.0.0.1    TCP 44 52962 → 10000 [ACK] Seq=865 Ack=806 Win=10196 Len=0
  159   0.269353    127.0.0.1 → 127.0.0.1    TCP 57 10000 → 52962 [PSH, ACK] Seq=806 Ack=865 Win=10036 Len=13
  160   0.269389    127.0.0.1 → 127.0.0.1    TCP 44 52962 → 10000 [ACK] Seq=865 Ack=819 Win=10196 Len=0
  161   0.269430    127.0.0.1 → 127.0.0.1    TCP 64 10000 → 52962 [PSH, ACK] Seq=819 Ack=865 Win=10036 Len=20
  162   0.269463    127.0.0.1 → 127.0.0.1    TCP 44 52962 → 10000 [ACK] Seq=865 Ack=839 Win=10196 Len=0
  163   0.269502    127.0.0.1 → 127.0.0.1    TCP 64 10000 → 52962 [PSH, ACK] Seq=839 Ack=865 Win=10036 Len=20
  164   0.269538    127.0.0.1 → 127.0.0.1    TCP 44 52962 → 10000 [ACK] Seq=865 Ack=859 Win=10196 Len=0
  165   0.269578    127.0.0.1 → 127.0.0.1    TCP 57 10000 → 52962 [PSH, ACK] Seq=859 Ack=865 Win=10036 Len=13
  166   0.269614    127.0.0.1 → 127.0.0.1    TCP 44 52962 → 10000 [ACK] Seq=865 Ack=872 Win=10196 Len=0
  167   0.269654    127.0.0.1 → 127.0.0.1    TCP 64 10000 → 52962 [PSH, ACK] Seq=872 Ack=865 Win=10036 Len=20
  168   0.269690    127.0.0.1 → 127.0.0.1    TCP 44 52962 → 10000 [ACK] Seq=865 Ack=892 Win=10196 Len=0
  169   0.269735    127.0.0.1 → 127.0.0.1    TCP 57 10000 → 52962 [PSH, ACK] Seq=892 Ack=865 Win=10036 Len=13
  170   0.269770    127.0.0.1 → 127.0.0.1    TCP 44 52962 → 10000 [ACK] Seq=865 Ack=905 Win=10196 Len=0
  171   0.269811    127.0.0.1 → 127.0.0.1    TCP 57 10000 → 52962 [PSH, ACK] Seq=905 Ack=865 Win=10036 Len=13
  172   0.269843    127.0.0.1 → 127.0.0.1    TCP 44 52962 → 10000 [ACK] Seq=865 Ack=918 Win=10196 Len=0
  173   0.269883    127.0.0.1 → 127.0.0.1    TCP 57 10000 → 52962 [PSH, ACK] Seq=918 Ack=865 Win=10036 Len=13
  174   0.269918    127.0.0.1 → 127.0.0.1    TCP 44 52962 → 10000 [ACK] Seq=865 Ack=931 Win=10196 Len=0
  175   0.269958    127.0.0.1 → 127.0.0.1    TCP 57 10000 → 52962 [PSH, ACK] Seq=931 Ack=865 Win=10036 Len=13
  176   0.269990    127.0.0.1 → 127.0.0.1    TCP 44 52962 → 10000 [ACK] Seq=865 Ack=944 Win=10196 Len=0
  177   0.270030    127.0.0.1 → 127.0.0.1    TCP 57 10000 → 52962 [PSH, ACK] Seq=944 Ack=865 Win=10036 Len=13
  178   0.270066    127.0.0.1 → 127.0.0.1    TCP 44 52962 → 10000 [ACK] Seq=865 Ack=957 Win=10196 Len=0
  179   0.514993    127.0.0.1 → 127.0.0.1    TCP 56 52962 → 10000 [PSH, ACK] Seq=865 Ack=957 Win=10196 Len=12
  180   0.515135    127.0.0.1 → 127.0.0.1    TCP 44 10000 → 52962 [ACK] Seq=957 Ack=877 Win=10036 Len=0
  181   0.515221    127.0.0.1 → 127.0.0.1    TCP 56 52962 → 10000 [PSH, ACK] Seq=877 Ack=957 Win=10196 Len=12
  182   0.515264    127.0.0.1 → 127.0.0.1    TCP 44 10000 → 52962 [ACK] Seq=957 Ack=889 Win=10036 Len=0
  183   0.515333    127.0.0.1 → 127.0.0.1    TCP 56 52962 → 10000 [PSH, ACK] Seq=889 Ack=957 Win=10196 Len=12
  184   0.515375    127.0.0.1 → 127.0.0.1    TCP 44 10000 → 52962 [ACK] Seq=957 Ack=901 Win=10035 Len=0
  185   0.515441    127.0.0.1 → 127.0.0.1    TCP 56 52962 → 10000 [PSH, ACK] Seq=901 Ack=957 Win=10196 Len=12
  186   0.515501    127.0.0.1 → 127.0.0.1    TCP 57 10000 → 52962 [PSH, ACK] Seq=957 Ack=913 Win=10035 Len=13
  187   0.515572    127.0.0.1 → 127.0.0.1    TCP 44 52962 → 10000 [ACK] Seq=913 Ack=970 Win=10196 Len=0
  188   0.515611    127.0.0.1 → 127.0.0.1    TCP 56 52962 → 10000 [PSH, ACK] Seq=913 Ack=970 Win=10196 Len=12
  189   0.515652    127.0.0.1 → 127.0.0.1    TCP 44 10000 → 52962 [ACK] Seq=970 Ack=925 Win=10035 Len=0
  190   0.515718    127.0.0.1 → 127.0.0.1    TCP 56 52962 → 10000 [PSH, ACK] Seq=925 Ack=970 Win=10196 Len=12
  191   0.515755    127.0.0.1 → 127.0.0.1    TCP 57 10000 → 52962 [PSH, ACK] Seq=970 Ack=925 Win=10035 Len=13
  192   0.515762    127.0.0.1 → 127.0.0.1    TCP 44 10000 → 52962 [ACK] Seq=983 Ack=937 Win=10035 Len=0
  193   0.515809    127.0.0.1 → 127.0.0.1    TCP 44 52962 → 10000 [ACK] Seq=937 Ack=983 Win=10196 Len=0
  194   0.515843    127.0.0.1 → 127.0.0.1    TCP 57 10000 → 52962 [PSH, ACK] Seq=983 Ack=937 Win=10035 Len=13
  195   0.515889    127.0.0.1 → 127.0.0.1    TCP 44 52962 → 10000 [ACK] Seq=937 Ack=996 Win=10196 Len=0
  196   0.515929    127.0.0.1 → 127.0.0.1    TCP 56 52962 → 10000 [PSH, ACK] Seq=937 Ack=996 Win=10196 Len=12
  197   0.515973    127.0.0.1 → 127.0.0.1    TCP 44 10000 → 52962 [ACK] Seq=996 Ack=949 Win=10035 Len=0
  198   0.515997    127.0.0.1 → 127.0.0.1    TCP 57 10000 → 52962 [PSH, ACK] Seq=996 Ack=949 Win=10035 Len=13
  199   0.516037    127.0.0.1 → 127.0.0.1    TCP 56 52962 → 10000 [PSH, ACK] Seq=949 Ack=1009 Win=10196 Len=12
  200   0.516115    127.0.0.1 → 127.0.0.1    TCP 44 10000 → 52962 [ACK] Seq=1009 Ack=961 Win=10035 Len=0
  201   0.516123    127.0.0.1 → 127.0.0.1    TCP 57 10000 → 52962 [PSH, ACK] Seq=1009 Ack=961 Win=10035 Len=13
  202   0.516187    127.0.0.1 → 127.0.0.1    TCP 104 52962 → 10000 [PSH, ACK] Seq=961 Ack=1022 Win=10196 Len=60
  203   0.516229    127.0.0.1 → 127.0.0.1    TCP 44 10000 → 52962 [ACK] Seq=1022 Ack=1021 Win=10035 Len=0
  204   0.516263    127.0.0.1 → 127.0.0.1    TCP 92 52962 → 10000 [PSH, ACK] Seq=1021 Ack=1022 Win=10196 Len=48
  205   0.516284    127.0.0.1 → 127.0.0.1    TCP 44 10000 → 52962 [ACK] Seq=1022 Ack=1069 Win=10035 Len=0
  206   0.516301    127.0.0.1 → 127.0.0.1    TCP 68 52962 → 10000 [PSH, ACK] Seq=1069 Ack=1022 Win=10196 Len=24
  207   0.516318    127.0.0.1 → 127.0.0.1    TCP 44 10000 → 52962 [ACK] Seq=1022 Ack=1093 Win=10035 Len=0
  208   0.516336    127.0.0.1 → 127.0.0.1    TCP 80 52962 → 10000 [PSH, ACK] Seq=1093 Ack=1022 Win=10196 Len=36
  209   0.516353    127.0.0.1 → 127.0.0.1    TCP 44 10000 → 52962 [ACK] Seq=1022 Ack=1129 Win=10035 Len=0
  210   0.516371    127.0.0.1 → 127.0.0.1    TCP 80 52962 → 10000 [PSH, ACK] Seq=1129 Ack=1022 Win=10196 Len=36
  211   0.516387    127.0.0.1 → 127.0.0.1    TCP 44 10000 → 52962 [ACK] Seq=1022 Ack=1165 Win=10034 Len=0
  212   0.516407    127.0.0.1 → 127.0.0.1    TCP 57 10000 → 52962 [PSH, ACK] Seq=1022 Ack=1165 Win=10034 Len=13
  213   0.516411    127.0.0.1 → 127.0.0.1    TCP 80 52962 → 10000 [PSH, ACK] Seq=1165 Ack=1022 Win=10196 Len=36
  214   0.516464    127.0.0.1 → 127.0.0.1    TCP 80 52962 → 10000 [PSH, ACK] Seq=1201 Ack=1035 Win=10196 Len=36
  215   0.516467    127.0.0.1 → 127.0.0.1    TCP 109 10000 → 52962 [PSH, ACK] Seq=1035 Ack=1201 Win=10034 Len=65
  216   0.516498    127.0.0.1 → 127.0.0.1    TCP 57 10000 → 52962 [PSH, ACK] Seq=1100 Ack=1237 Win=10034 Len=13
  217   0.516501    127.0.0.1 → 127.0.0.1    TCP 56 52962 → 10000 [PSH, ACK] Seq=1237 Ack=1100 Win=10195 Len=12
  218   0.516531    127.0.0.1 → 127.0.0.1    TCP 44 52962 → 10000 [ACK] Seq=1249 Ack=1113 Win=10195 Len=0
  219   0.516534    127.0.0.1 → 127.0.0.1    TCP 44 10000 → 52962 [ACK] Seq=1113 Ack=1249 Win=10034 Len=0
  220   0.516552    127.0.0.1 → 127.0.0.1    TCP 56 52962 → 10000 [PSH, ACK] Seq=1249 Ack=1113 Win=10195 Len=12
  221   0.516568    127.0.0.1 → 127.0.0.1    TCP 44 10000 → 52962 [ACK] Seq=1113 Ack=1261 Win=10034 Len=0
  222   0.516646    127.0.0.1 → 127.0.0.1    TCP 56 52962 → 10000 [PSH, ACK] Seq=1261 Ack=1113 Win=10195 Len=12
  223   0.516678    127.0.0.1 → 127.0.0.1    TCP 44 10000 → 52962 [ACK] Seq=1113 Ack=1273 Win=10034 Len=0
  224   0.516733    127.0.0.1 → 127.0.0.1    TCP 56 52962 → 10000 [PSH, ACK] Seq=1273 Ack=1113 Win=10195 Len=12
  225   0.516763    127.0.0.1 → 127.0.0.1    TCP 44 10000 → 52962 [ACK] Seq=1113 Ack=1285 Win=10034 Len=0
  226   0.516809    127.0.0.1 → 127.0.0.1    TCP 56 52962 → 10000 [PSH, ACK] Seq=1285 Ack=1113 Win=10195 Len=12
  227   0.516838    127.0.0.1 → 127.0.0.1    TCP 44 10000 → 52962 [ACK] Seq=1113 Ack=1297 Win=10034 Len=0
  228   0.517015    127.0.0.1 → 127.0.0.1    TCP 57 10000 → 52962 [PSH, ACK] Seq=1113 Ack=1297 Win=10034 Len=13
  229   0.517052    127.0.0.1 → 127.0.0.1    TCP 44 52962 → 10000 [ACK] Seq=1297 Ack=1126 Win=10195 Len=0
  230   0.517090    127.0.0.1 → 127.0.0.1    TCP 57 10000 → 52962 [PSH, ACK] Seq=1126 Ack=1297 Win=10034 Len=13
  231   0.517118    127.0.0.1 → 127.0.0.1    TCP 44 52962 → 10000 [ACK] Seq=1297 Ack=1139 Win=10195 Len=0
  232   0.517154    127.0.0.1 → 127.0.0.1    TCP 64 10000 → 52962 [PSH, ACK] Seq=1139 Ack=1297 Win=10034 Len=20
  233   0.517181    127.0.0.1 → 127.0.0.1    TCP 44 52962 → 10000 [ACK] Seq=1297 Ack=1159 Win=10195 Len=0
  234   0.517216    127.0.0.1 → 127.0.0.1    TCP 64 10000 → 52962 [PSH, ACK] Seq=1159 Ack=1297 Win=10034 Len=20
  235   0.517243    127.0.0.1 → 127.0.0.1    TCP 44 52962 → 10000 [ACK] Seq=1297 Ack=1179 Win=10195 Len=0
  236   0.517278    127.0.0.1 → 127.0.0.1    TCP 57 10000 → 52962 [PSH, ACK] Seq=1179 Ack=1297 Win=10034 Len=13
  237   0.517311    127.0.0.1 → 127.0.0.1    TCP 44 52962 → 10000 [ACK] Seq=1297 Ack=1192 Win=10195 Len=0
  238   0.517346    127.0.0.1 → 127.0.0.1    TCP 57 10000 → 52962 [PSH, ACK] Seq=1192 Ack=1297 Win=10034 Len=13
  239   0.517374    127.0.0.1 → 127.0.0.1    TCP 44 52962 → 10000 [ACK] Seq=1297 Ack=1205 Win=10195 Len=0
  240   0.517409    127.0.0.1 → 127.0.0.1    TCP 57 10000 → 52962 [PSH, ACK] Seq=1205 Ack=1297 Win=10034 Len=13
  241   0.517441    127.0.0.1 → 127.0.0.1    TCP 44 52962 → 10000 [ACK] Seq=1297 Ack=1218 Win=10195 Len=0
  242   0.517476    127.0.0.1 → 127.0.0.1    TCP 64 10000 → 52962 [PSH, ACK] Seq=1218 Ack=1297 Win=10034 Len=20
  243   0.517508    127.0.0.1 → 127.0.0.1    TCP 44 52962 → 10000 [ACK] Seq=1297 Ack=1238 Win=10195 Len=0
  244   0.517544    127.0.0.1 → 127.0.0.1    TCP 64 10000 → 52962 [PSH, ACK] Seq=1238 Ack=1297 Win=10034 Len=20
  245   0.517576    127.0.0.1 → 127.0.0.1    TCP 44 52962 → 10000 [ACK] Seq=1297 Ack=1258 Win=10195 Len=0
  246   0.517611    127.0.0.1 → 127.0.0.1    TCP 57 10000 → 52962 [PSH, ACK] Seq=1258 Ack=1297 Win=10034 Len=13
  247   0.517639    127.0.0.1 → 127.0.0.1    TCP 44 52962 → 10000 [ACK] Seq=1297 Ack=1271 Win=10195 Len=0
  248   0.517674    127.0.0.1 → 127.0.0.1    TCP 57 10000 → 52962 [PSH, ACK] Seq=1271 Ack=1297 Win=10034 Len=13
  249   0.517701    127.0.0.1 → 127.0.0.1    TCP 44 52962 → 10000 [ACK] Seq=1297 Ack=1284 Win=10195 Len=0
  250   0.517751    127.0.0.1 → 127.0.0.1    TCP 57 10000 → 52962 [PSH, ACK] Seq=1284 Ack=1297 Win=10034 Len=13
  251   0.517783    127.0.0.1 → 127.0.0.1    TCP 44 52962 → 10000 [ACK] Seq=1297 Ack=1297 Win=10195 Len=0
  252   0.517830    127.0.0.1 → 127.0.0.1    TCP 64 10000 → 52962 [PSH, ACK] Seq=1297 Ack=1297 Win=10034 Len=20
  253   0.517862    127.0.0.1 → 127.0.0.1    TCP 44 52962 → 10000 [ACK] Seq=1297 Ack=1317 Win=10194 Len=0
  254   0.517898    127.0.0.1 → 127.0.0.1    TCP 64 10000 → 52962 [PSH, ACK] Seq=1317 Ack=1297 Win=10034 Len=20
  255   0.517925    127.0.0.1 → 127.0.0.1    TCP 44 52962 → 10000 [ACK] Seq=1297 Ack=1337 Win=10194 Len=0
  256   0.517960    127.0.0.1 → 127.0.0.1    TCP 57 10000 → 52962 [PSH, ACK] Seq=1337 Ack=1297 Win=10034 Len=13
  257   0.517987    127.0.0.1 → 127.0.0.1    TCP 44 52962 → 10000 [ACK] Seq=1297 Ack=1350 Win=10194 Len=0
  258   0.518022    127.0.0.1 → 127.0.0.1    TCP 64 10000 → 52962 [PSH, ACK] Seq=1350 Ack=1297 Win=10034 Len=20
  259   0.518050    127.0.0.1 → 127.0.0.1    TCP 44 52962 → 10000 [ACK] Seq=1297 Ack=1370 Win=10194 Len=0
  260   0.518086    127.0.0.1 → 127.0.0.1    TCP 57 10000 → 52962 [PSH, ACK] Seq=1370 Ack=1297 Win=10034 Len=13
  261   0.518113    127.0.0.1 → 127.0.0.1    TCP 44 52962 → 10000 [ACK] Seq=1297 Ack=1383 Win=10194 Len=0
  262   0.518148    127.0.0.1 → 127.0.0.1    TCP 57 10000 → 52962 [PSH, ACK] Seq=1383 Ack=1297 Win=10034 Len=13
  263   0.518180    127.0.0.1 → 127.0.0.1    TCP 44 52962 → 10000 [ACK] Seq=1297 Ack=1396 Win=10194 Len=0
  264   0.518450    127.0.0.1 → 127.0.0.1    TCP 57 10000 → 52962 [PSH, ACK] Seq=1396 Ack=1297 Win=10034 Len=13
  265   0.518484    127.0.0.1 → 127.0.0.1    TCP 44 52962 → 10000 [ACK] Seq=1297 Ack=1409 Win=10194 Len=0
  266   0.518521    127.0.0.1 → 127.0.0.1    TCP 57 10000 → 52962 [PSH, ACK] Seq=1409 Ack=1297 Win=10034 Len=13
  267   0.518553    127.0.0.1 → 127.0.0.1    TCP 44 52962 → 10000 [ACK] Seq=1297 Ack=1422 Win=10194 Len=0
  268   0.518588    127.0.0.1 → 127.0.0.1    TCP 57 10000 → 52962 [PSH, ACK] Seq=1422 Ack=1297 Win=10034 Len=13
  269   0.518620    127.0.0.1 → 127.0.0.1    TCP 44 52962 → 10000 [ACK] Seq=1297 Ack=1435 Win=10194 Len=0
  270   0.765951    127.0.0.1 → 127.0.0.1    TCP 56 52962 → 10000 [PSH, ACK] Seq=1297 Ack=1435 Win=10194 Len=12
  271   0.766057    127.0.0.1 → 127.0.0.1    TCP 44 10000 → 52962 [ACK] Seq=1435 Ack=1309 Win=10034 Len=0
  272   0.766114    127.0.0.1 → 127.0.0.1    TCP 56 52962 → 10000 [PSH, ACK] Seq=1309 Ack=1435 Win=10194 Len=12
  273   0.766145    127.0.0.1 → 127.0.0.1    TCP 44 10000 → 52962 [ACK] Seq=1435 Ack=1321 Win=10034 Len=0
  274   0.766187    127.0.0.1 → 127.0.0.1    TCP 56 52962 → 10000 [PSH, ACK] Seq=1321 Ack=1435 Win=10194 Len=12
  275   0.766216    127.0.0.1 → 127.0.0.1    TCP 44 10000 → 52962 [ACK] Seq=1435 Ack=1333 Win=10034 Len=0
  276   0.766257    127.0.0.1 → 127.0.0.1    TCP 56 52962 → 10000 [PSH, ACK] Seq=1333 Ack=1435 Win=10194 Len=12
  277   0.766285    127.0.0.1 → 127.0.0.1    TCP 44 10000 → 52962 [ACK] Seq=1435 Ack=1345 Win=10034 Len=0
  278   0.766326    127.0.0.1 → 127.0.0.1    TCP 56 52962 → 10000 [PSH, ACK] Seq=1345 Ack=1435 Win=10194 Len=12
  279   0.766354    127.0.0.1 → 127.0.0.1    TCP 44 10000 → 52962 [ACK] Seq=1435 Ack=1357 Win=10034 Len=0
  280   0.766395    127.0.0.1 → 127.0.0.1    TCP 56 52962 → 10000 [PSH, ACK] Seq=1357 Ack=1435 Win=10194 Len=12
  281   0.766424    127.0.0.1 → 127.0.0.1    TCP 57 10000 → 52962 [PSH, ACK] Seq=1435 Ack=1357 Win=10034 Len=13
  282   0.766431    127.0.0.1 → 127.0.0.1    TCP 44 10000 → 52962 [ACK] Seq=1448 Ack=1369 Win=10034 Len=0
  283   0.766480    127.0.0.1 → 127.0.0.1    TCP 44 52962 → 10000 [ACK] Seq=1369 Ack=1448 Win=10194 Len=0
  284   0.766514    127.0.0.1 → 127.0.0.1    TCP 57 10000 → 52962 [PSH, ACK] Seq=1448 Ack=1369 Win=10034 Len=13
  285   0.766559    127.0.0.1 → 127.0.0.1    TCP 44 52962 → 10000 [ACK] Seq=1369 Ack=1461 Win=10194 Len=0
  286   0.766595    127.0.0.1 → 127.0.0.1    TCP 56 52962 → 10000 [PSH, ACK] Seq=1369 Ack=1461 Win=10194 Len=12
  287   0.766638    127.0.0.1 → 127.0.0.1    TCP 44 10000 → 52962 [ACK] Seq=1461 Ack=1381 Win=10034 Len=0
  288   0.766671    127.0.0.1 → 127.0.0.1    TCP 57 10000 → 52962 [PSH, ACK] Seq=1461 Ack=1381 Win=10034 Len=13
  289   0.766720    127.0.0.1 → 127.0.0.1    TCP 56 52962 → 10000 [PSH, ACK] Seq=1381 Ack=1461 Win=10194 Len=12
  290   0.766732    127.0.0.1 → 127.0.0.1    TCP 44 52962 → 10000 [ACK] Seq=1393 Ack=1474 Win=10194 Len=0
  291   0.766773    127.0.0.1 → 127.0.0.1    TCP 70 10000 → 52962 [PSH, ACK] Seq=1474 Ack=1393 Win=10034 Len=26
  292   0.766815    127.0.0.1 → 127.0.0.1    TCP 92 52962 → 10000 [PSH, ACK] Seq=1393 Ack=1500 Win=10194 Len=48
  293   0.766846    127.0.0.1 → 127.0.0.1    TCP 44 10000 → 52962 [ACK] Seq=1500 Ack=1441 Win=10033 Len=0
  294   0.766872    127.0.0.1 → 127.0.0.1    TCP 68 52962 → 10000 [PSH, ACK] Seq=1441 Ack=1500 Win=10194 Len=24
  295   0.766901    127.0.0.1 → 127.0.0.1    TCP 57 10000 → 52962 [PSH, ACK] Seq=1500 Ack=1441 Win=10033 Len=13
  296   0.766907    127.0.0.1 → 127.0.0.1    TCP 44 10000 → 52962 [ACK] Seq=1513 Ack=1465 Win=10033 Len=0
  297   0.766942    127.0.0.1 → 127.0.0.1    TCP 80 52962 → 10000 [PSH, ACK] Seq=1465 Ack=1513 Win=10194 Len=36
  298   0.766975    127.0.0.1 → 127.0.0.1    TCP 57 10000 → 52962 [PSH, ACK] Seq=1513 Ack=1501 Win=10033 Len=13
  299   0.767013    127.0.0.1 → 127.0.0.1    TCP 92 52962 → 10000 [PSH, ACK] Seq=1501 Ack=1526 Win=10194 Len=48
  300   0.767045    127.0.0.1 → 127.0.0.1    TCP 44 10000 → 52962 [ACK] Seq=1526 Ack=1549 Win=10033 Len=0
  301   0.767077    127.0.0.1 → 127.0.0.1    TCP 80 52962 → 10000 [PSH, ACK] Seq=1549 Ack=1526 Win=10194 Len=36
  302   0.767107    127.0.0.1 → 127.0.0.1    TCP 44 10000 → 52962 [ACK] Seq=1526 Ack=1585 Win=10033 Len=0
  303   0.767134    127.0.0.1 → 127.0.0.1    TCP 80 52962 → 10000 [PSH, ACK] Seq=1585 Ack=1526 Win=10194 Len=36
  304   0.767161    127.0.0.1 → 127.0.0.1    TCP 44 10000 → 52962 [ACK] Seq=1526 Ack=1621 Win=10033 Len=0
  305   0.767211    127.0.0.1 → 127.0.0.1    TCP 56 52962 → 10000 [PSH, ACK] Seq=1621 Ack=1526 Win=10194 Len=12
  306   0.767234    127.0.0.1 → 127.0.0.1    TCP 57 10000 → 52962 [PSH, ACK] Seq=1526 Ack=1621 Win=10033 Len=13
  307   0.767274    127.0.0.1 → 127.0.0.1    TCP 44 10000 → 52962 [ACK] Seq=1539 Ack=1633 Win=10033 Len=0
  308   0.767291    127.0.0.1 → 127.0.0.1    TCP 44 52962 → 10000 [ACK] Seq=1633 Ack=1539 Win=10194 Len=0
  309   0.767322    127.0.0.1 → 127.0.0.1    TCP 56 52962 → 10000 [PSH, ACK] Seq=1633 Ack=1539 Win=10194 Len=12
  310   0.767327    127.0.0.1 → 127.0.0.1    TCP 142 10000 → 52962 [PSH, ACK] Seq=1539 Ack=1633 Win=10033 Len=98
  311   0.767380    127.0.0.1 → 127.0.0.1    TCP 64 10000 → 52962 [PSH, ACK] Seq=1637 Ack=1645 Win=10033 Len=20
  312   0.767386    127.0.0.1 → 127.0.0.1    TCP 68 52962 → 10000 [PSH, ACK] Seq=1645 Ack=1637 Win=10193 Len=24
  313   0.767440    127.0.0.1 → 127.0.0.1    TCP 56 52962 → 10000 [PSH, ACK] Seq=1669 Ack=1657 Win=10193 Len=12
  314   0.767445    127.0.0.1 → 127.0.0.1    TCP 44 10000 → 52962 [ACK] Seq=1657 Ack=1669 Win=10032 Len=0
  315   0.767482    127.0.0.1 → 127.0.0.1    TCP 44 10000 → 52962 [ACK] Seq=1657 Ack=1681 Win=10032 Len=0
  316   0.767485    127.0.0.1 → 127.0.0.1    TCP 56 52962 → 10000 [PSH, ACK] Seq=1681 Ack=1657 Win=10193 Len=12
  317   0.767504    127.0.0.1 → 127.0.0.1    TCP 44 10000 → 52962 [ACK] Seq=1657 Ack=1693 Win=10032 Len=0
  318   0.767579    127.0.0.1 → 127.0.0.1    TCP 56 52962 → 10000 [PSH, ACK] Seq=1693 Ack=1657 Win=10193 Len=12
  319   0.767612    127.0.0.1 → 127.0.0.1    TCP 44 10000 → 52962 [ACK] Seq=1657 Ack=1705 Win=10032 Len=0
  320   0.767663    127.0.0.1 → 127.0.0.1    TCP 56 52962 → 10000 [PSH, ACK] Seq=1705 Ack=1657 Win=10193 Len=12
  321   0.767692    127.0.0.1 → 127.0.0.1    TCP 44 10000 → 52962 [ACK] Seq=1657 Ack=1717 Win=10032 Len=0
  322   0.767742    127.0.0.1 → 127.0.0.1    TCP 56 52962 → 10000 [PSH, ACK] Seq=1717 Ack=1657 Win=10193 Len=12
  323   0.767771    127.0.0.1 → 127.0.0.1    TCP 44 10000 → 52962 [ACK] Seq=1657 Ack=1729 Win=10032 Len=0
  324   0.767844    127.0.0.1 → 127.0.0.1    TCP 57 10000 → 52962 [PSH, ACK] Seq=1657 Ack=1729 Win=10032 Len=13
  325   0.767907    127.0.0.1 → 127.0.0.1    TCP 44 52962 → 10000 [ACK] Seq=1729 Ack=1670 Win=10193 Len=0
  326   0.767972    127.0.0.1 → 127.0.0.1    TCP 57 10000 → 52962 [PSH, ACK] Seq=1670 Ack=1729 Win=10032 Len=13
  327   0.768029    127.0.0.1 → 127.0.0.1    TCP 44 52962 → 10000 [ACK] Seq=1729 Ack=1683 Win=10193 Len=0
  328   0.768091    127.0.0.1 → 127.0.0.1    TCP 57 10000 → 52962 [PSH, ACK] Seq=1683 Ack=1729 Win=10032 Len=13
  329   0.768147    127.0.0.1 → 127.0.0.1    TCP 44 52962 → 10000 [ACK] Seq=1729 Ack=1696 Win=10193 Len=0
  330   0.768208    127.0.0.1 → 127.0.0.1    TCP 64 10000 → 52962 [PSH, ACK] Seq=1696 Ack=1729 Win=10032 Len=20
  331   0.768264    127.0.0.1 → 127.0.0.1    TCP 44 52962 → 10000 [ACK] Seq=1729 Ack=1716 Win=10193 Len=0
  332   0.768325    127.0.0.1 → 127.0.0.1    TCP 64 10000 → 52962 [PSH, ACK] Seq=1716 Ack=1729 Win=10032 Len=20
  333   0.768381    127.0.0.1 → 127.0.0.1    TCP 44 52962 → 10000 [ACK] Seq=1729 Ack=1736 Win=10193 Len=0
  334   0.768443    127.0.0.1 → 127.0.0.1    TCP 57 10000 → 52962 [PSH, ACK] Seq=1736 Ack=1729 Win=10032 Len=13
  335   0.768500    127.0.0.1 → 127.0.0.1    TCP 44 52962 → 10000 [ACK] Seq=1729 Ack=1749 Win=10193 Len=0
  336   0.768561    127.0.0.1 → 127.0.0.1    TCP 57 10000 → 52962 [PSH, ACK] Seq=1749 Ack=1729 Win=10032 Len=13
  337   0.768617    127.0.0.1 → 127.0.0.1    TCP 44 52962 → 10000 [ACK] Seq=1729 Ack=1762 Win=10193 Len=0
  338   0.768678    127.0.0.1 → 127.0.0.1    TCP 57 10000 → 52962 [PSH, ACK] Seq=1762 Ack=1729 Win=10032 Len=13
  339   0.768738    127.0.0.1 → 127.0.0.1    TCP 44 52962 → 10000 [ACK] Seq=1729 Ack=1775 Win=10193 Len=0
  340   0.768801    127.0.0.1 → 127.0.0.1    TCP 64 10000 → 52962 [PSH, ACK] Seq=1775 Ack=1729 Win=10032 Len=20
  341   0.768856    127.0.0.1 → 127.0.0.1    TCP 44 52962 → 10000 [ACK] Seq=1729 Ack=1795 Win=10193 Len=0
  342   0.768917    127.0.0.1 → 127.0.0.1    TCP 64 10000 → 52962 [PSH, ACK] Seq=1795 Ack=1729 Win=10032 Len=20
  343   0.768973    127.0.0.1 → 127.0.0.1    TCP 44 52962 → 10000 [ACK] Seq=1729 Ack=1815 Win=10193 Len=0
  344   0.769033    127.0.0.1 → 127.0.0.1    TCP 57 10000 → 52962 [PSH, ACK] Seq=1815 Ack=1729 Win=10032 Len=13
  345   0.769088    127.0.0.1 → 127.0.0.1    TCP 44 52962 → 10000 [ACK] Seq=1729 Ack=1828 Win=10192 Len=0
  346   0.769447    127.0.0.1 → 127.0.0.1    TCP 64 10000 → 52962 [PSH, ACK] Seq=1828 Ack=1729 Win=10032 Len=20
  347   0.769485    127.0.0.1 → 127.0.0.1    TCP 44 52962 → 10000 [ACK] Seq=1729 Ack=1848 Win=10192 Len=0
  348   0.769524    127.0.0.1 → 127.0.0.1    TCP 57 10000 → 52962 [PSH, ACK] Seq=1848 Ack=1729 Win=10032 Len=13
  349   0.769552    127.0.0.1 → 127.0.0.1    TCP 44 52962 → 10000 [ACK] Seq=1729 Ack=1861 Win=10192 Len=0
  350   0.769588    127.0.0.1 → 127.0.0.1    TCP 57 10000 → 52962 [PSH, ACK] Seq=1861 Ack=1729 Win=10032 Len=13
  351   0.769618    127.0.0.1 → 127.0.0.1    TCP 44 52962 → 10000 [ACK] Seq=1729 Ack=1874 Win=10192 Len=0
  352   0.769653    127.0.0.1 → 127.0.0.1    TCP 57 10000 → 52962 [PSH, ACK] Seq=1874 Ack=1729 Win=10032 Len=13
  353   0.769686    127.0.0.1 → 127.0.0.1    TCP 44 52962 → 10000 [ACK] Seq=1729 Ack=1887 Win=10192 Len=0
  354   0.769732    127.0.0.1 → 127.0.0.1    TCP 57 10000 → 52962 [PSH, ACK] Seq=1887 Ack=1729 Win=10032 Len=13
  355   0.769765    127.0.0.1 → 127.0.0.1    TCP 44 52962 → 10000 [ACK] Seq=1729 Ack=1900 Win=10192 Len=0
  356   0.769802    127.0.0.1 → 127.0.0.1    TCP 57 10000 → 52962 [PSH, ACK] Seq=1900 Ack=1729 Win=10032 Len=13
  357   0.769829    127.0.0.1 → 127.0.0.1    TCP 44 52962 → 10000 [ACK] Seq=1729 Ack=1913 Win=10192 Len=0
  358   1.029935    127.0.0.1 → 127.0.0.1    TCP 56 52962 → 10000 [PSH, ACK] Seq=1729 Ack=1913 Win=10192 Len=12
  359   1.030050    127.0.0.1 → 127.0.0.1    TCP 44 10000 → 52962 [ACK] Seq=1913 Ack=1741 Win=10032 Len=0
  360   1.030107    127.0.0.1 → 127.0.0.1    TCP 56 52962 → 10000 [PSH, ACK] Seq=1741 Ack=1913 Win=10192 Len=12
  361   1.030154    127.0.0.1 → 127.0.0.1    TCP 44 10000 → 52962 [ACK] Seq=1913 Ack=1753 Win=10032 Len=0
  362   1.030201    127.0.0.1 → 127.0.0.1    TCP 56 52962 → 10000 [PSH, ACK] Seq=1753 Ack=1913 Win=10192 Len=12
  363   1.030232    127.0.0.1 → 127.0.0.1    TCP 44 10000 → 52962 [ACK] Seq=1913 Ack=1765 Win=10032 Len=0
  364   1.030273    127.0.0.1 → 127.0.0.1    TCP 57 10000 → 52962 [PSH, ACK] Seq=1913 Ack=1765 Win=10032 Len=13
  365   1.030323    127.0.0.1 → 127.0.0.1    TCP 56 52962 → 10000 [PSH, ACK] Seq=1765 Ack=1913 Win=10192 Len=12
  366   1.030331    127.0.0.1 → 127.0.0.1    TCP 68 52962 → 10000 [PSH, ACK] Seq=1777 Ack=1926 Win=10192 Len=24
  367   1.030382    127.0.0.1 → 127.0.0.1    TCP 44 10000 → 52962 [ACK] Seq=1926 Ack=1801 Win=10032 Len=0
  368   1.030420    127.0.0.1 → 127.0.0.1    TCP 116 52962 → 10000 [PSH, ACK] Seq=1801 Ack=1926 Win=10192 Len=72
  369   1.030516    127.0.0.1 → 127.0.0.1    TCP 44 10000 → 52962 [ACK] Seq=1926 Ack=1873 Win=10032 Len=0
  370   1.030569    127.0.0.1 → 127.0.0.1    TCP 188 52962 → 10000 [PSH, ACK] Seq=1873 Ack=1926 Win=10192 Len=144
